,number,value,datetime_start,datetime_complete,duration,params_batch_size,params_buffer_size,params_gamma,params_learning_rate,params_learning_starts,params_log_std_init,params_net_arch,params_tau,params_train_freq,state
116,116,-21089.333865800003,2023-08-16 20:31:46.375614,2023-08-16 20:31:49.157388,0 days 00:00:02.781774,256,1000000,0.95,0.00011930831942119352,10000,-0.9904260295077941,small,0.02,4,PRUNED
117,117,-18320.533549,2023-08-16 20:31:49.158922,2023-08-16 20:31:50.280680,0 days 00:00:01.121758,1024,1000000,0.999,1.9991877926944158e-05,1000,-3.612235607907002,medium,0.001,32,PRUNED
118,118,-17699.610678600002,2023-08-16 20:31:50.281564,2023-08-16 20:31:51.249520,0 days 00:00:00.967956,256,1000000,0.999,0.00012617607416988457,1000,-3.7376656473211165,medium,0.005,32,PRUNED
119,119,-296.80134940000005,2023-08-16 20:31:51.250424,2023-08-16 20:31:54.053937,0 days 00:00:02.803513,32,1000000,0.995,7.984152366090795e-05,10000,-1.3291743569042744,medium,0.001,32,COMPLETE
120,120,-17136.9539972,2023-08-16 20:31:54.055350,2023-08-16 20:31:55.032311,0 days 00:00:00.976961,128,1000000,0.98,0.00046895040977575607,1000,-0.15916551485070152,medium,0.02,32,PRUNED
121,121,-17814.493982599997,2023-08-16 20:31:55.033195,2023-08-16 20:31:56.068011,0 days 00:00:01.034816,128,1000000,0.98,0.0057941966479371,10000,0.06398152259409062,medium,0.02,32,PRUNED
122,122,-17684.751191800002,2023-08-16 20:31:56.068996,2023-08-16 20:31:57.118253,0 days 00:00:01.049257,256,1000000,0.9,1.0996424355275572e-05,10000,-1.3928959786036585,medium,0.02,32,PRUNED
123,123,-17587.3913788,2023-08-16 20:31:57.119353,2023-08-16 20:31:58.184538,0 days 00:00:01.065185,32,1000000,0.95,0.0003544452121478072,10000,-1.153757331987229,medium,0.001,32,PRUNED
124,124,-17348.683577199998,2023-08-16 20:31:58.185443,2023-08-16 20:31:59.223607,0 days 00:00:01.038164,32,10000,0.95,6.227612135500185e-05,20000,-0.9076304962721049,big,0.05,512,PRUNED
125,125,-23665.8346108,2023-08-16 20:31:59.224966,2023-08-16 20:32:01.375628,0 days 00:00:02.150662,32,1000000,0.995,1.9423593411708193e-05,10000,-0.9901495023431084,small,0.001,32,PRUNED
126,126,-53280.52026460001,2023-08-16 20:32:01.376521,2023-08-16 20:32:03.491014,0 days 00:00:02.114493,32,1000000,0.995,3.514977088312234e-05,10000,-0.7911837244239638,medium,0.001,128,PRUNED
127,127,-17602.7527064,2023-08-16 20:32:03.492649,2023-08-16 20:32:04.460281,0 days 00:00:00.967632,32,1000000,0.995,0.00018550967149107286,10000,-1.7595736490796074,medium,0.001,32,PRUNED
128,128,-17875.1023182,2023-08-16 20:32:04.461201,2023-08-16 20:32:05.560053,0 days 00:00:01.098852,32,10000,0.98,4.335046010499417e-05,20000,-0.695866564620061,medium,0.08,512,PRUNED
129,129,-18067.1683416,2023-08-16 20:32:05.563198,2023-08-16 20:32:06.779651,0 days 00:00:01.216453,256,1000000,0.999,0.0013449439004369756,20000,-1.9322293216042423,medium,0.02,128,PRUNED
130,130,-17066.8959764,2023-08-16 20:32:06.781511,2023-08-16 20:32:07.653667,0 days 00:00:00.872156,32,1000000,0.999,1.0665138099702842e-05,10000,-0.5924878273081527,medium,0.005,32,PRUNED
131,131,,2023-08-16 20:32:07.654903,,,256,100000,0.999,0.0002779471795644255,10000,-2.5137281131983142,medium,0.02,32,RUNNING
